name,display_name,data_type,chart_type
"Korea, Exports, Middle East, Work day adjusted, Contribution to YoY chg, ppts, 3mma","Korea, Exports, Middle East, Work day adjusted, Contribution to YoY chg, ppts, 3mma",None,bar
"Korea, Exports, Netherlands, Work day adjusted, Contribution to YoY chg, ppts, 3mma","Korea, Exports, Netherlands, Work day adjusted, Contribution to YoY chg, ppts, 3mma",None,bar
"Korea, Exports, North America, Work day adjusted, Contribution to YoY chg, ppts, 3mma","Korea, Exports, North America, Work day adjusted, Contribution to YoY chg, ppts, 3mma",None,bar
"Korea, Exports, Oceania, Work day adjusted, Contribution to YoY chg, ppts, 3mma","Korea, Exports, Oceania, Work day adjusted, Contribution to YoY chg, ppts, 3mma",None,bar
"Korea, Exports, Panama, Work day adjusted, Contribution to YoY chg, ppts, 3mma","Korea, Exports, Panama, Work day adjusted, Contribution to YoY chg, ppts, 3mma",None,bar
"Korea, Exports, Philippines, Work day adjusted, Contribution to YoY chg, ppts, 3mma","Korea, Exports, Philippines, Work day adjusted, Contribution to YoY chg, ppts, 3mma",None,bar
"Korea, Exports, Russia, Work day adjusted, Contribution to YoY chg, ppts, 3mma","Korea, Exports, Russia, Work day adjusted, Contribution to YoY chg, ppts, 3mma",None,bar
"Korea, Exports, Saudi Arabia, Work day adjusted, Contribution to YoY chg, ppts, 3mma","Korea, Exports, Saudi Arabia, Work day adjusted, Contribution to YoY chg, ppts, 3mma",None,bar
"Korea, Exports, Singapore, Work day adjusted, Contribution to YoY chg, ppts, 3mma","Korea, Exports, Singapore, Work day adjusted, Contribution to YoY chg, ppts, 3mma",None,bar
"Korea, Exports, Switzerland, Work day adjusted, Contribution to YoY chg, ppts, 3mma","Korea, Exports, Switzerland, Work day adjusted, Contribution to YoY chg, ppts, 3mma",None,bar
"Korea, Exports, Taiwan, Work day adjusted, Contribution to YoY chg, ppts, 3mma","Korea, Exports, Taiwan, Work day adjusted, Contribution to YoY chg, ppts, 3mma",None,bar
"Korea, Exports, Thailand, Work day adjusted, Contribution to YoY chg, ppts, 3mma","Korea, Exports, Thailand, Work day adjusted, Contribution to YoY chg, ppts, 3mma",None,bar
"Korea, Exports, U.A.B, Work day adjusted, Contribution to YoY chg, ppts, 3mma","Korea, Exports, U.A.B, Work day adjusted, Contribution to YoY chg, ppts, 3mma",None,bar
"Korea, Exports, UK, Work day adjusted, Contribution to YoY chg, ppts, 3mma","Korea, Exports, UK, Work day adjusted, Contribution to YoY chg, ppts, 3mma",None,bar
"Korea, Exports, US, Work day adjusted, Contribution to YoY chg, ppts, 3mma","Korea, Exports, US, Work day adjusted, Contribution to YoY chg, ppts, 3mma",None,bar
"Korea, Exports, Vietnam, Work day adjusted, Contribution to YoY chg, ppts, 3mma","Korea, Exports, Vietnam, Work day adjusted, Contribution to YoY chg, ppts, 3mma",None,bar
"Korea, Exports, Automobile parts, Work day adjusted, Contribution to YoY chg, ppts, 3mma","Korea, Exports, Automobile parts, Work day adjusted, Contribution to YoY chg, ppts, 3mma",None,bar
"Korea, Exports, Autos, Work day adjusted, Contribution to YoY chg, ppts, 3mma","Korea, Exports, Autos, Work day adjusted, Contribution to YoY chg, ppts, 3mma",None,bar
"Korea, Exports, Computer peripherals, Work day adjusted, Contribution to YoY chg, ppts, 3mma","Korea, Exports, Computer peripherals, Work day adjusted, Contribution to YoY chg, ppts, 3mma",None,bar
"Korea, Exports, Home appliances, Work day adjusted, Contribution to YoY chg, ppts, 3mma","Korea, Exports, Home appliances, Work day adjusted, Contribution to YoY chg, ppts, 3mma",None,bar
"Korea, Exports, Mobile phones, Work day adjusted, Contribution to YoY chg, ppts, 3mma","Korea, Exports, Mobile phones, Work day adjusted, Contribution to YoY chg, ppts, 3mma",None,bar
"Korea, Exports, Petroleum products, Work day adjusted, Contribution to YoY chg, ppts, 3mma","Korea, Exports, Petroleum products, Work day adjusted, Contribution to YoY chg, ppts, 3mma",None,bar
"Korea, Exports, Precision equipment, Work day adjusted, Contribution to YoY chg, ppts, 3mma","Korea, Exports, Precision equipment, Work day adjusted, Contribution to YoY chg, ppts, 3mma",None,bar
"Korea, Exports, Semiconductor mfg equipment, Work day adjusted, Contribution to YoY chg, ppts, 3mma","Korea, Exports, Semiconductor mfg equipment, Work day adjusted, Contribution to YoY chg, ppts, 3mma",None,bar
"Korea, Exports, Semiconductors, Work day adjusted, Contribution to YoY chg, ppts, 3mma","Korea, Exports, Semiconductors, Work day adjusted, Contribution to YoY chg, ppts, 3mma",None,bar
"Korea, Exports, Ships, Work day adjusted, Contribution to YoY chg, ppts, 3mma","Korea, Exports, Ships, Work day adjusted, Contribution to YoY chg, ppts, 3mma",None,bar
"Korea, Exports, Steel products, Work day adjusted, Contribution to YoY chg, ppts, 3mma","Korea, Exports, Steel products, Work day adjusted, Contribution to YoY chg, ppts, 3mma",None,bar
"Korea, Exports, Wireless communication equipment, Work day adjusted, Contribution to YoY chg, ppts, 3mma","Korea, Exports, Wireless communication equipment, Work day adjusted, Contribution to YoY chg, ppts, 3mma",None,bar
"Korea, Exports, mineral fuels, Work day adjusted, Contribution to YoY chg, ppts, 3mma","Korea, Exports, mineral fuels, Work day adjusted, Contribution to YoY chg, ppts, 3mma",None,bar
"Korea, Exports, All ex ships, Work day adjusted, Contribution to YoY chg, ppts, 3mma","Korea, Exports, All ex ships, Work day adjusted, Contribution to YoY chg, ppts, 3mma",None,bar
"Korea, Exports, Tech, Work day adjusted, Contribution to YoY chg, ppts, 3mma","Korea, Exports, Tech, Work day adjusted, Contribution to YoY chg, ppts, 3mma",None,bar
"Korea, Exports, Tech excluding semiconductors, Work day adjusted, Contribution to YoY chg, ppts, 3mma","Korea, Exports, Tech excluding semiconductors, Work day adjusted, Contribution to YoY chg, ppts, 3mma",None,bar
"Korea, Exports, Auto and parts, Work day adjusted, Contribution to YoY chg, ppts, 3mma","Korea, Exports, Auto and parts, Work day adjusted, Contribution to YoY chg, ppts, 3mma",None,bar
"Korea, Exports, North Asia, Work day adjusted, Contribution to YoY chg, ppts, 3mma","Korea, Exports, North Asia, Work day adjusted, Contribution to YoY chg, ppts, 3mma",None,bar
"Korea, Exports, DM, Work day adjusted, Contribution to YoY chg, ppts, 3mma","Korea, Exports, DM, Work day adjusted, Contribution to YoY chg, ppts, 3mma",None,bar
"Korea, Exports, China and Hong Kong, Work day adjusted, Contribution to YoY chg, ppts, 3mma","Korea, Exports, China and Hong Kong, Work day adjusted, Contribution to YoY chg, ppts, 3mma",None,bar
"Korea, Exports, Developed Europe, Work day adjusted, Contribution to YoY chg, ppts, 3mma","Korea, Exports, Developed Europe, Work day adjusted, Contribution to YoY chg, ppts, 3mma",None,bar
"Korea, Exports, DM excl Japan, Work day adjusted, Contribution to YoY chg, ppts, 3mma","Korea, Exports, DM excl Japan, Work day adjusted, Contribution to YoY chg, ppts, 3mma",None,bar
"Korea, Exports, Rest of world, Work day adjusted, Contribution to YoY chg, ppts, 3mma","Korea, Exports, Rest of world, Work day adjusted, Contribution to YoY chg, ppts, 3mma",None,bar
"Korea, Exports, ASEAN Three and India, Work day adjusted, Contribution to YoY chg, ppts, 3mma","Korea, Exports, ASEAN Three and India, Work day adjusted, Contribution to YoY chg, ppts, 3mma",None,bar
"Korea, Exports, Excluding semiconductors, Work day adjusted, Contribution to YoY chg, ppts, 3mma","Korea, Exports, Excluding semiconductors, Work day adjusted, Contribution to YoY chg, ppts, 3mma",None,bar
"Korea, Imports, All, Work day adjusted, Contribution to YoY chg, ppts, 3mma","Korea, Imports, All, Work day adjusted, Contribution to YoY chg, ppts, 3mma",None,bar
"Korea, Imports, ASEAN, Work day adjusted, Contribution to YoY chg, ppts, 3mma","Korea, Imports, ASEAN, Work day adjusted, Contribution to YoY chg, ppts, 3mma",None,bar
"Korea, Imports, Africa, Work day adjusted, Contribution to YoY chg, ppts, 3mma","Korea, Imports, Africa, Work day adjusted, Contribution to YoY chg, ppts, 3mma",None,bar
"Korea, Imports, Asia, Work day adjusted, Contribution to YoY chg, ppts, 3mma","Korea, Imports, Asia, Work day adjusted, Contribution to YoY chg, ppts, 3mma",None,bar
"Korea, Imports, Australia, Work day adjusted, Contribution to YoY chg, ppts, 3mma","Korea, Imports, Australia, Work day adjusted, Contribution to YoY chg, ppts, 3mma",None,bar
"Korea, Imports, Brazil, Work day adjusted, Contribution to YoY chg, ppts, 3mma","Korea, Imports, Brazil, Work day adjusted, Contribution to YoY chg, ppts, 3mma",None,bar
"Korea, Imports, Canada, Work day adjusted, Contribution to YoY chg, ppts, 3mma","Korea, Imports, Canada, Work day adjusted, Contribution to YoY chg, ppts, 3mma",None,bar
"Korea, Imports, China, Work day adjusted, Contribution to YoY chg, ppts, 3mma","Korea, Imports, China, Work day adjusted, Contribution to YoY chg, ppts, 3mma",None,bar
"Korea, Imports, EU, Work day adjusted, Contribution to YoY chg, ppts, 3mma","Korea, Imports, EU, Work day adjusted, Contribution to YoY chg, ppts, 3mma",None,bar
"Korea, Imports, Europe, Work day adjusted, Contribution to YoY chg, ppts, 3mma","Korea, Imports, Europe, Work day adjusted, Contribution to YoY chg, ppts, 3mma",None,bar
"Korea, Imports, France, Work day adjusted, Contribution to YoY chg, ppts, 3mma","Korea, Imports, France, Work day adjusted, Contribution to YoY chg, ppts, 3mma",None,bar
"Korea, Imports, Germany, Work day adjusted, Contribution to YoY chg, ppts, 3mma","Korea, Imports, Germany, Work day adjusted, Contribution to YoY chg, ppts, 3mma",None,bar
"Korea, Imports, Hong Kong, Work day adjusted, Contribution to YoY chg, ppts, 3mma","Korea, Imports, Hong Kong, Work day adjusted, Contribution to YoY chg, ppts, 3mma",None,bar
"Korea, Imports, India, Work day adjusted, Contribution to YoY chg, ppts, 3mma","Korea, Imports, India, Work day adjusted, Contribution to YoY chg, ppts, 3mma",None,bar
"Korea, Imports, Indonesia, Work day adjusted, Contribution to YoY chg, ppts, 3mma","Korea, Imports, Indonesia, Work day adjusted, Contribution to YoY chg, ppts, 3mma",None,bar
"Korea, Imports, Italy, Work day adjusted, Contribution to YoY chg, ppts, 3mma","Korea, Imports, Italy, Work day adjusted, Contribution to YoY chg, ppts, 3mma",None,bar
"Korea, Imports, Japan, Work day adjusted, Contribution to YoY chg, ppts, 3mma","Korea, Imports, Japan, Work day adjusted, Contribution to YoY chg, ppts, 3mma",None,bar
"Korea, Imports, Latin America, Work day adjusted, Contribution to YoY chg, ppts, 3mma","Korea, Imports, Latin America, Work day adjusted, Contribution to YoY chg, ppts, 3mma",None,bar
"Korea, Imports, Malaysia, Work day adjusted, Contribution to YoY chg, ppts, 3mma","Korea, Imports, Malaysia, Work day adjusted, Contribution to YoY chg, ppts, 3mma",None,bar
"Korea, Imports, Middle East, Work day adjusted, Contribution to YoY chg, ppts, 3mma","Korea, Imports, Middle East, Work day adjusted, Contribution to YoY chg, ppts, 3mma",None,bar
"Korea, Imports, Netherlands, Work day adjusted, Contribution to YoY chg, ppts, 3mma","Korea, Imports, Netherlands, Work day adjusted, Contribution to YoY chg, ppts, 3mma",None,bar
"Korea, Imports, North America, Work day adjusted, Contribution to YoY chg, ppts, 3mma","Korea, Imports, North America, Work day adjusted, Contribution to YoY chg, ppts, 3mma",None,bar
"Korea, Imports, Oceania, Work day adjusted, Contribution to YoY chg, ppts, 3mma","Korea, Imports, Oceania, Work day adjusted, Contribution to YoY chg, ppts, 3mma",None,bar
"Korea, Imports, Panama, Work day adjusted, Contribution to YoY chg, ppts, 3mma","Korea, Imports, Panama, Work day adjusted, Contribution to YoY chg, ppts, 3mma",None,bar
"Korea, Imports, Philippines, Work day adjusted, Contribution to YoY chg, ppts, 3mma","Korea, Imports, Philippines, Work day adjusted, Contribution to YoY chg, ppts, 3mma",None,bar
"Korea, Imports, Russia, Work day adjusted, Contribution to YoY chg, ppts, 3mma","Korea, Imports, Russia, Work day adjusted, Contribution to YoY chg, ppts, 3mma",None,bar
"Korea, Imports, Saudi Arabia, Work day adjusted, Contribution to YoY chg, ppts, 3mma","Korea, Imports, Saudi Arabia, Work day adjusted, Contribution to YoY chg, ppts, 3mma",None,bar
"Korea, Imports, Singapore, Work day adjusted, Contribution to YoY chg, ppts, 3mma","Korea, Imports, Singapore, Work day adjusted, Contribution to YoY chg, ppts, 3mma",None,bar
"Korea, Imports, Switzerland, Work day adjusted, Contribution to YoY chg, ppts, 3mma","Korea, Imports, Switzerland, Work day adjusted, Contribution to YoY chg, ppts, 3mma",None,bar
"Korea, Imports, Taiwan, Work day adjusted, Contribution to YoY chg, ppts, 3mma","Korea, Imports, Taiwan, Work day adjusted, Contribution to YoY chg, ppts, 3mma",None,bar
"Korea, Imports, Thailand, Work day adjusted, Contribution to YoY chg, ppts, 3mma","Korea, Imports, Thailand, Work day adjusted, Contribution to YoY chg, ppts, 3mma",None,bar
"Korea, Imports, U.A.B, Work day adjusted, Contribution to YoY chg, ppts, 3mma","Korea, Imports, U.A.B, Work day adjusted, Contribution to YoY chg, ppts, 3mma",None,bar
"Korea, Imports, UK, Work day adjusted, Contribution to YoY chg, ppts, 3mma","Korea, Imports, UK, Work day adjusted, Contribution to YoY chg, ppts, 3mma",None,bar
"Korea, Imports, US, Work day adjusted, Contribution to YoY chg, ppts, 3mma","Korea, Imports, US, Work day adjusted, Contribution to YoY chg, ppts, 3mma",None,bar
"Korea, Imports, Vietnam, Work day adjusted, Contribution to YoY chg, ppts, 3mma","Korea, Imports, Vietnam, Work day adjusted, Contribution to YoY chg, ppts, 3mma",None,bar
"Korea, Imports, Autos, Work day adjusted, Contribution to YoY chg, ppts, 3mma","Korea, Imports, Autos, Work day adjusted, Contribution to YoY chg, ppts, 3mma",None,bar
"Korea, Imports, Coal, Work day adjusted, Contribution to YoY chg, ppts, 3mma","Korea, Imports, Coal, Work day adjusted, Contribution to YoY chg, ppts, 3mma",None,bar
"Korea, Imports, Crude oil, Work day adjusted, Contribution to YoY chg, ppts, 3mma","Korea, Imports, Crude oil, Work day adjusted, Contribution to YoY chg, ppts, 3mma",None,bar
"Korea, Imports, Gas, Work day adjusted, Contribution to YoY chg, ppts, 3mma","Korea, Imports, Gas, Work day adjusted, Contribution to YoY chg, ppts, 3mma",None,bar
"Korea, Imports, Machinery, Work day adjusted, Contribution to YoY chg, ppts, 3mma","Korea, Imports, Machinery, Work day adjusted, Contribution to YoY chg, ppts, 3mma",None,bar
"Korea, Imports, Mobile phones, Work day adjusted, Contribution to YoY chg, ppts, 3mma","Korea, Imports, Mobile phones, Work day adjusted, Contribution to YoY chg, ppts, 3mma",None,bar
"Korea, Imports, Petroleum products, Work day adjusted, Contribution to YoY chg, ppts, 3mma","Korea, Imports, Petroleum products, Work day adjusted, Contribution to YoY chg, ppts, 3mma",None,bar
"Korea, Imports, Precision equipment, Work day adjusted, Contribution to YoY chg, ppts, 3mma","Korea, Imports, Precision equipment, Work day adjusted, Contribution to YoY chg, ppts, 3mma",None,bar
"Korea, Imports, Semiconductor mfg equipment, Work day adjusted, Contribution to YoY chg, ppts, 3mma","Korea, Imports, Semiconductor mfg equipment, Work day adjusted, Contribution to YoY chg, ppts, 3mma",None,bar
"Korea, Imports, Semiconductors, Work day adjusted, Contribution to YoY chg, ppts, 3mma","Korea, Imports, Semiconductors, Work day adjusted, Contribution to YoY chg, ppts, 3mma",None,bar
"Korea, Imports, Wireless communication equipment, Work day adjusted, Contribution to YoY chg, ppts, 3mma","Korea, Imports, Wireless communication equipment, Work day adjusted, Contribution to YoY chg, ppts, 3mma",None,bar
"Korea, Imports, mineral fuels, Work day adjusted, Contribution to YoY chg, ppts, 3mma","Korea, Imports, mineral fuels, Work day adjusted, Contribution to YoY chg, ppts, 3mma",None,bar
"Korea, Imports, Energy, Work day adjusted, Contribution to YoY chg, ppts, 3mma","Korea, Imports, Energy, Work day adjusted, Contribution to YoY chg, ppts, 3mma",None,bar
"Korea, Imports, Commodity producers, Work day adjusted, Contribution to YoY chg, ppts, 3mma","Korea, Imports, Commodity producers, Work day adjusted, Contribution to YoY chg, ppts, 3mma",None,bar
"Korea, Imports, North Asia, Work day adjusted, Contribution to YoY chg, ppts, 3mma","Korea, Imports, North Asia, Work day adjusted, Contribution to YoY chg, ppts, 3mma",None,bar
"Korea, Imports, DM, Work day adjusted, Contribution to YoY chg, ppts, 3mma","Korea, Imports, DM, Work day adjusted, Contribution to YoY chg, ppts, 3mma",None,bar
"Korea, Imports, China and Hong Kong, Work day adjusted, Contribution to YoY chg, ppts, 3mma","Korea, Imports, China and Hong Kong, Work day adjusted, Contribution to YoY chg, ppts, 3mma",None,bar
"Korea, Imports, Developed Europe, Work day adjusted, Contribution to YoY chg, ppts, 3mma","Korea, Imports, Developed Europe, Work day adjusted, Contribution to YoY chg, ppts, 3mma",None,bar
"Korea, Imports, DM excl Japan, Work day adjusted, Contribution to YoY chg, ppts, 3mma","Korea, Imports, DM excl Japan, Work day adjusted, Contribution to YoY chg, ppts, 3mma",None,bar
"Korea, Imports, Rest of world, Work day adjusted, Contribution to YoY chg, ppts, 3mma","Korea, Imports, Rest of world, Work day adjusted, Contribution to YoY chg, ppts, 3mma",None,bar
"Korea, Imports, ASEAN Three and India, Work day adjusted, Contribution to YoY chg, ppts, 3mma","Korea, Imports, ASEAN Three and India, Work day adjusted, Contribution to YoY chg, ppts, 3mma",None,bar
"Korea, Exports, Autos, SA, USD bn, % MoM, 3mma","Korea, Exports, Autos, SA, USD bn, % MoM, 3mma",None,line
"Korea, Exports, Petroleum products, SA, USD bn, % MoM, 3mma","Korea, Exports, Petroleum products, SA, USD bn, % MoM, 3mma",None,line
"Korea, Exports, Semiconductors, SA, USD bn, % MoM, 3mma","Korea, Exports, Semiconductors, SA, USD bn, % MoM, 3mma",None,line
"Korea, Exports, Ships, SA, USD bn, % MoM, 3mma","Korea, Exports, Ships, SA, USD bn, % MoM, 3mma",None,line
"Korea, Exports, Steel products, SA, USD bn, % MoM, 3mma","Korea, Exports, Steel products, SA, USD bn, % MoM, 3mma",None,line
"Korea, Imports, Semiconductor mfg equipment, SA, USD bn, % MoM, 3mma","Korea, Imports, Semiconductor mfg equipment, SA, USD bn, % MoM, 3mma",None,line
"Korea, Imports, Energy, SA, USD bn, % MoM, 3mma","Korea, Imports, Energy, SA, USD bn, % MoM, 3mma",None,line
"Korea, Exports, Tech, SA, USD bn, % MoM, 3mma","Korea, Exports, Tech, SA, USD bn, % MoM, 3mma",None,line
"Korea, Exports, Tech excluding semiconductors, SA, USD bn, % MoM, 3mma","Korea, Exports, Tech excluding semiconductors, SA, USD bn, % MoM, 3mma",None,line
"Korea, Exports, Auto and parts, SA, USD bn, % MoM, 3mma","Korea, Exports, Auto and parts, SA, USD bn, % MoM, 3mma",None,line
"Korea, Exports, Excluding semiconductors, SA, USD bn, % MoM, 3mma","Korea, Exports, Excluding semiconductors, SA, USD bn, % MoM, 3mma",None,line
"Korea, Exports, Autos, Work day adjusted, SA, USD bn, % MoM, 3mma","Korea, Exports, Autos, Work day adjusted, SA, USD bn, % MoM, 3mma",None,line
"Korea, Exports, Petroleum products, Work day adjusted, SA, USD bn, % MoM, 3mma","Korea, Exports, Petroleum products, Work day adjusted, SA, USD bn, % MoM, 3mma",None,line
"Korea, Exports, Semiconductors, Work day adjusted, SA, USD bn, % MoM, 3mma","Korea, Exports, Semiconductors, Work day adjusted, SA, USD bn, % MoM, 3mma",None,line
"Korea, Exports, Ships, Work day adjusted, SA, USD bn, % MoM, 3mma","Korea, Exports, Ships, Work day adjusted, SA, USD bn, % MoM, 3mma",None,line
"Korea, Exports, Steel products, Work day adjusted, SA, USD bn, % MoM, 3mma","Korea, Exports, Steel products, Work day adjusted, SA, USD bn, % MoM, 3mma",None,line
"Korea, Imports, Semiconductor mfg equipment, Work day adjusted, SA, USD bn, % MoM, 3mma","Korea, Imports, Semiconductor mfg equipment, Work day adjusted, SA, USD bn, % MoM, 3mma",None,line
"Korea, Imports, Energy, Work day adjusted, SA, USD bn, % MoM, 3mma","Korea, Imports, Energy, Work day adjusted, SA, USD bn, % MoM, 3mma",None,line
"Korea, Exports, Tech, Work day adjusted, SA, USD bn, % MoM, 3mma","Korea, Exports, Tech, Work day adjusted, SA, USD bn, % MoM, 3mma",None,line
"Korea, Exports, Tech excluding semiconductors, Work day adjusted, SA, USD bn, % MoM, 3mma","Korea, Exports, Tech excluding semiconductors, Work day adjusted, SA, USD bn, % MoM, 3mma",None,line
"Korea, Exports, Auto and parts, Work day adjusted, SA, USD bn, % MoM, 3mma","Korea, Exports, Auto and parts, Work day adjusted, SA, USD bn, % MoM, 3mma",None,line
"Korea, Exports, Excluding semiconductors, Work day adjusted, SA, USD bn, % MoM, 3mma","Korea, Exports, Excluding semiconductors, Work day adjusted, SA, USD bn, % MoM, 3mma",None,line
"Korea, Exports, All, SA, USD bn, % MoM, 3mma","Korea, Exports, All, SA, USD bn, % MoM, 3mma",None,line
"Korea, Exports, ASEAN, SA, USD bn, % MoM, 3mma","Korea, Exports, ASEAN, SA, USD bn, % MoM, 3mma",None,line
"Korea, Exports, China, SA, USD bn, % MoM, 3mma","Korea, Exports, China, SA, USD bn, % MoM, 3mma",None,line
"Korea, Exports, EU, SA, USD bn, % MoM, 3mma","Korea, Exports, EU, SA, USD bn, % MoM, 3mma",None,line
"Korea, Exports, US, SA, USD bn, % MoM, 3mma","Korea, Exports, US, SA, USD bn, % MoM, 3mma",None,line
"Korea, Imports, All, SA, USD bn, % MoM, 3mma","Korea, Imports, All, SA, USD bn, % MoM, 3mma",None,line
"Korea, Imports, ASEAN, SA, USD bn, % MoM, 3mma","Korea, Imports, ASEAN, SA, USD bn, % MoM, 3mma",None,line
"Korea, Imports, China, SA, USD bn, % MoM, 3mma","Korea, Imports, China, SA, USD bn, % MoM, 3mma",None,line
"Korea, Imports, EU, SA, USD bn, % MoM, 3mma","Korea, Imports, EU, SA, USD bn, % MoM, 3mma",None,line
"Korea, Imports, US, SA, USD bn, % MoM, 3mma","Korea, Imports, US, SA, USD bn, % MoM, 3mma",None,line
"Korea, Exports, All ex ships, SA, USD bn, % MoM, 3mma","Korea, Exports, All ex ships, SA, USD bn, % MoM, 3mma",None,line
"Korea, Exports, North Asia, SA, USD bn, % MoM, 3mma","Korea, Exports, North Asia, SA, USD bn, % MoM, 3mma",None,line
"Korea, Exports, China and Hong Kong, SA, USD bn, % MoM, 3mma","Korea, Exports, China and Hong Kong, SA, USD bn, % MoM, 3mma",None,line
"Korea, Exports, Developed Europe, SA, USD bn, % MoM, 3mma","Korea, Exports, Developed Europe, SA, USD bn, % MoM, 3mma",None,line
"Korea, Exports, DM excl Japan, SA, USD bn, % MoM, 3mma","Korea, Exports, DM excl Japan, SA, USD bn, % MoM, 3mma",None,line
"Korea, Exports, Rest of world, SA, USD bn, % MoM, 3mma","Korea, Exports, Rest of world, SA, USD bn, % MoM, 3mma",None,line
"Korea, Exports, ASEAN Three and India, SA, USD bn, % MoM, 3mma","Korea, Exports, ASEAN Three and India, SA, USD bn, % MoM, 3mma",None,line
"Korea, Imports, North Asia, SA, USD bn, % MoM, 3mma","Korea, Imports, North Asia, SA, USD bn, % MoM, 3mma",None,line
"Korea, Imports, China and Hong Kong, SA, USD bn, % MoM, 3mma","Korea, Imports, China and Hong Kong, SA, USD bn, % MoM, 3mma",None,line
"Korea, Imports, Developed Europe, SA, USD bn, % MoM, 3mma","Korea, Imports, Developed Europe, SA, USD bn, % MoM, 3mma",None,line
"Korea, Imports, DM excl Japan, SA, USD bn, % MoM, 3mma","Korea, Imports, DM excl Japan, SA, USD bn, % MoM, 3mma",None,line
"Korea, Imports, Rest of world, SA, USD bn, % MoM, 3mma","Korea, Imports, Rest of world, SA, USD bn, % MoM, 3mma",None,line
"Korea, Imports, ASEAN Three and India, SA, USD bn, % MoM, 3mma","Korea, Imports, ASEAN Three and India, SA, USD bn, % MoM, 3mma",None,line
"Korea, Imports, All, SA, KRW bn, % MoM, 3mma","Korea, Imports, All, SA, KRW bn, % MoM, 3mma",None,line
"Korea, Exports, All, SA, KRW bn, % MoM, 3mma","Korea, Exports, All, SA, KRW bn, % MoM, 3mma",None,line
"Korea, Exports, All, Work day adjusted, SA, USD bn, % MoM, 3mma","Korea, Exports, All, Work day adjusted, SA, USD bn, % MoM, 3mma",None,line
"Korea, Imports, All, Work day adjusted, SA, USD bn, % MoM, 3mma","Korea, Imports, All, Work day adjusted, SA, USD bn, % MoM, 3mma",None,line
"Korea, Exports, ASEAN, Work day adjusted, SA, USD bn, % MoM, 3mma","Korea, Exports, ASEAN, Work day adjusted, SA, USD bn, % MoM, 3mma",None,line
"Korea, Exports, China, Work day adjusted, SA, USD bn, % MoM, 3mma","Korea, Exports, China, Work day adjusted, SA, USD bn, % MoM, 3mma",None,line
"Korea, Exports, US, Work day adjusted, SA, USD bn, % MoM, 3mma","Korea, Exports, US, Work day adjusted, SA, USD bn, % MoM, 3mma",None,line
"Korea, Exports, All ex ships, Work day adjusted, SA, USD bn, % MoM, 3mma","Korea, Exports, All ex ships, Work day adjusted, SA, USD bn, % MoM, 3mma",None,line
"Korea, Exports, North Asia, Work day adjusted, SA, USD bn, % MoM, 3mma","Korea, Exports, North Asia, Work day adjusted, SA, USD bn, % MoM, 3mma",None,line
"Korea, Exports, China and Hong Kong, Work day adjusted, SA, USD bn, % MoM, 3mma","Korea, Exports, China and Hong Kong, Work day adjusted, SA, USD bn, % MoM, 3mma",None,line
"Korea, Exports, Developed Europe, Work day adjusted, SA, USD bn, % MoM, 3mma","Korea, Exports, Developed Europe, Work day adjusted, SA, USD bn, % MoM, 3mma",None,line
"Korea, Exports, DM excl Japan, Work day adjusted, SA, USD bn, % MoM, 3mma","Korea, Exports, DM excl Japan, Work day adjusted, SA, USD bn, % MoM, 3mma",None,line
"Korea, Exports, Rest of world, Work day adjusted, SA, USD bn, % MoM, 3mma","Korea, Exports, Rest of world, Work day adjusted, SA, USD bn, % MoM, 3mma",None,line
"Korea, Exports, ASEAN Three and India, Work day adjusted, SA, USD bn, % MoM, 3mma","Korea, Exports, ASEAN Three and India, Work day adjusted, SA, USD bn, % MoM, 3mma",None,line
"Korea, Exports, Autos, Contribution to MoM chg, ppts, 3mma","Korea, Exports, Autos, Contribution to MoM chg, ppts, 3mma",None,bar
"Korea, Exports, Petroleum products, Contribution to MoM chg, ppts, 3mma","Korea, Exports, Petroleum products, Contribution to MoM chg, ppts, 3mma",None,bar
