name,display_name,data_type,chart_type
"Japan, Exports, All, JPY bn","Japan, Exports, All, JPY bn",None,line
"Japan, Imports, All, JPY bn","Japan, Imports, All, JPY bn",None,line
"Japan, Imports, Group, Chemicals, JPY bn","Japan, Imports, Group, Chemicals, JPY bn",None,line
"Japan, Imports, Group, Electrical machinery, JPY bn","Japan, Imports, Group, Electrical machinery, JPY bn",None,line
"Japan, Imports, Group, Foodstuffs, JPY bn","Japan, Imports, Group, Foodstuffs, JPY bn",None,line
"Japan, Imports, Group, Machinery, JPY bn","Japan, Imports, Group, Machinery, JPY bn",None,line
"Japan, Imports, Group, Manufactured goods, JPY bn","Japan, Imports, Group, Manufactured goods, JPY bn",None,line
"Japan, Imports, Group, Mineral fuels, JPY bn","Japan, Imports, Group, Mineral fuels, JPY bn",None,line
"Japan, Imports, Group, Others, JPY bn","Japan, Imports, Group, Others, JPY bn",None,line
"Japan, Imports, Group, Raw materials, JPY bn","Japan, Imports, Group, Raw materials, JPY bn",None,line
"Japan, Imports, Group, Transport equipment, JPY bn","Japan, Imports, Group, Transport equipment, JPY bn",None,line
"Japan, Imports, IC, JPY bn","Japan, Imports, IC, JPY bn",None,line
"Japan, Imports, Semiconductors, JPY bn","Japan, Imports, Semiconductors, JPY bn",None,line
"Japan, Exports, Passenger cars, JPY bn","Japan, Exports, Passenger cars, JPY bn",None,line
"Japan, Exports, Group, Chemicals, JPY bn","Japan, Exports, Group, Chemicals, JPY bn",None,line
"Japan, Exports, Group, Electrical machinery, JPY bn","Japan, Exports, Group, Electrical machinery, JPY bn",None,line
"Japan, Exports, Group, Foodstuffs, JPY bn","Japan, Exports, Group, Foodstuffs, JPY bn",None,line
"Japan, Exports, Group, Machinery, JPY bn","Japan, Exports, Group, Machinery, JPY bn",None,line
"Japan, Exports, Group, Manufactured goods, JPY bn","Japan, Exports, Group, Manufactured goods, JPY bn",None,line
"Japan, Exports, Group, Mineral fuels, JPY bn","Japan, Exports, Group, Mineral fuels, JPY bn",None,line
"Japan, Exports, Group, Others, JPY bn","Japan, Exports, Group, Others, JPY bn",None,line
"Japan, Exports, Group, Raw materials, JPY bn","Japan, Exports, Group, Raw materials, JPY bn",None,line
"Japan, Exports, Group, Transport equipment, JPY bn","Japan, Exports, Group, Transport equipment, JPY bn",None,line
"Japan, Exports, IC, JPY bn","Japan, Exports, IC, JPY bn",None,line
"Japan, Exports, Semicon machinery, JPY bn","Japan, Exports, Semicon machinery, JPY bn",None,line
"Japan, Exports, Semiconductors, JPY bn","Japan, Exports, Semiconductors, JPY bn",None,line
"Japan, Exports, Ships, JPY bn","Japan, Exports, Ships, JPY bn",None,line
"Japan, Exports, ASEAN, JPY bn","Japan, Exports, ASEAN, JPY bn",None,line
"Japan, Exports, Africa, JPY bn","Japan, Exports, Africa, JPY bn",None,line
"Japan, Exports, Asia, JPY bn","Japan, Exports, Asia, JPY bn",None,line
"Japan, Exports, Central and Eastern Europe, JPY bn","Japan, Exports, Central and Eastern Europe, JPY bn",None,line
"Japan, Exports, China, JPY bn","Japan, Exports, China, JPY bn",None,line
"Japan, Exports, Developed Europe, JPY bn","Japan, Exports, Developed Europe, JPY bn",None,line
"Japan, Exports, EU, JPY bn","Japan, Exports, EU, JPY bn",None,line
"Japan, Exports, Hong Kong, JPY bn","Japan, Exports, Hong Kong, JPY bn",None,line
"Japan, Exports, Middle East, JPY bn","Japan, Exports, Middle East, JPY bn",None,line
"Japan, Exports, Middle South America, JPY bn","Japan, Exports, Middle South America, JPY bn",None,line
"Japan, Exports, North America, JPY bn","Japan, Exports, North America, JPY bn",None,line
"Japan, Exports, Taiwan, JPY bn","Japan, Exports, Taiwan, JPY bn",None,line
"Japan, Exports, Total, JPY bn","Japan, Exports, Total, JPY bn",None,line
"Japan, Exports, US, JPY bn","Japan, Exports, US, JPY bn",None,line
"Japan, Exports, Vietnam, JPY bn","Japan, Exports, Vietnam, JPY bn",None,line
"Japan, Exports, World, JPY bn","Japan, Exports, World, JPY bn",None,line
"Japan, Exports, nan, JPY bn","Japan, Exports, nan, JPY bn",None,line
"Japan, Imports, ASEAN, JPY bn","Japan, Imports, ASEAN, JPY bn",None,line
"Japan, Imports, Africa, JPY bn","Japan, Imports, Africa, JPY bn",None,line
"Japan, Imports, Asia, JPY bn","Japan, Imports, Asia, JPY bn",None,line
"Japan, Imports, Central and Eastern Europe, JPY bn","Japan, Imports, Central and Eastern Europe, JPY bn",None,line
"Japan, Imports, China, JPY bn","Japan, Imports, China, JPY bn",None,line
"Japan, Imports, Developed Europe, JPY bn","Japan, Imports, Developed Europe, JPY bn",None,line
"Japan, Imports, EU, JPY bn","Japan, Imports, EU, JPY bn",None,line
"Japan, Imports, Hong Kong, JPY bn","Japan, Imports, Hong Kong, JPY bn",None,line
"Japan, Imports, Middle East, JPY bn","Japan, Imports, Middle East, JPY bn",None,line
"Japan, Imports, Middle South America, JPY bn","Japan, Imports, Middle South America, JPY bn",None,line
"Japan, Imports, North America, JPY bn","Japan, Imports, North America, JPY bn",None,line
"Japan, Imports, Taiwan, JPY bn","Japan, Imports, Taiwan, JPY bn",None,line
"Japan, Imports, Total, JPY bn","Japan, Imports, Total, JPY bn",None,line
"Japan, Imports, US, JPY bn","Japan, Imports, US, JPY bn",None,line
"Japan, Imports, Vietnam, JPY bn","Japan, Imports, Vietnam, JPY bn",None,line
"Japan, Imports, World, JPY bn","Japan, Imports, World, JPY bn",None,line
"Japan, Imports, nan, JPY bn","Japan, Imports, nan, JPY bn",None,line
"Japan, Exports, China, Passenger cars, JPY bn","Japan, Exports, China, Passenger cars, JPY bn",None,line
"Japan, Exports, China, Group, Chemicals, JPY bn","Japan, Exports, China, Group, Chemicals, JPY bn",None,line
"Japan, Exports, China, Group, Electrical machinery, JPY bn","Japan, Exports, China, Group, Electrical machinery, JPY bn",None,line
"Japan, Exports, China, Group, Foodstuffs, JPY bn","Japan, Exports, China, Group, Foodstuffs, JPY bn",None,line
"Japan, Exports, China, Group, Machinery, JPY bn","Japan, Exports, China, Group, Machinery, JPY bn",None,line
"Japan, Exports, China, Group, Manufactured goods, JPY bn","Japan, Exports, China, Group, Manufactured goods, JPY bn",None,line
"Japan, Exports, China, Group, Mineral fuels, JPY bn","Japan, Exports, China, Group, Mineral fuels, JPY bn",None,line
"Japan, Exports, China, Group, Others, JPY bn","Japan, Exports, China, Group, Others, JPY bn",None,line
"Japan, Exports, China, Group, Raw materials, JPY bn","Japan, Exports, China, Group, Raw materials, JPY bn",None,line
"Japan, Exports, China, Group, Transport equipment, JPY bn","Japan, Exports, China, Group, Transport equipment, JPY bn",None,line
"Japan, Exports, China, IC, JPY bn","Japan, Exports, China, IC, JPY bn",None,line
"Japan, Exports, China, Semicon machinery, JPY bn","Japan, Exports, China, Semicon machinery, JPY bn",None,line
"Japan, Exports, China, Semiconductors, JPY bn","Japan, Exports, China, Semiconductors, JPY bn",None,line
"Japan, Exports, China, Ships, JPY bn","Japan, Exports, China, Ships, JPY bn",None,line
"Japan, Exports, China, Total, JPY bn","Japan, Exports, China, Total, JPY bn",None,line
"Japan, Imports, China, Group, Chemicals, JPY bn","Japan, Imports, China, Group, Chemicals, JPY bn",None,line
"Japan, Imports, China, Group, Electrical machinery, JPY bn","Japan, Imports, China, Group, Electrical machinery, JPY bn",None,line
"Japan, Imports, China, Group, Foodstuffs, JPY bn","Japan, Imports, China, Group, Foodstuffs, JPY bn",None,line
"Japan, Imports, China, Group, Machinery, JPY bn","Japan, Imports, China, Group, Machinery, JPY bn",None,line
"Japan, Imports, China, Group, Manufactured goods, JPY bn","Japan, Imports, China, Group, Manufactured goods, JPY bn",None,line
"Japan, Imports, China, Group, Mineral fuels, JPY bn","Japan, Imports, China, Group, Mineral fuels, JPY bn",None,line
"Japan, Imports, China, Group, Others, JPY bn","Japan, Imports, China, Group, Others, JPY bn",None,line
"Japan, Imports, China, Group, Raw materials, JPY bn","Japan, Imports, China, Group, Raw materials, JPY bn",None,line
"Japan, Imports, China, Group, Transport equipment, JPY bn","Japan, Imports, China, Group, Transport equipment, JPY bn",None,line
"Japan, Imports, China, IC, JPY bn","Japan, Imports, China, IC, JPY bn",None,line
"Japan, Imports, China, Semiconductors, JPY bn","Japan, Imports, China, Semiconductors, JPY bn",None,line
"Japan, Imports, China, Total, JPY bn","Japan, Imports, China, Total, JPY bn",None,line
"Japan, Exports, US, Passenger cars, JPY bn","Japan, Exports, US, Passenger cars, JPY bn",None,line
"Japan, Exports, US, Passenger cars, Volume, mn","Japan, Exports, US, Passenger cars, Volume, mn",None,line
"Japan, Exports, US, Group, Chemicals, JPY bn","Japan, Exports, US, Group, Chemicals, JPY bn",None,line
"Japan, Exports, US, Group, Electrical machinery, JPY bn","Japan, Exports, US, Group, Electrical machinery, JPY bn",None,line
"Japan, Exports, US, Group, Foodstuffs, JPY bn","Japan, Exports, US, Group, Foodstuffs, JPY bn",None,line
"Japan, Exports, US, Group, Machinery, JPY bn","Japan, Exports, US, Group, Machinery, JPY bn",None,line
"Japan, Exports, US, Group, Manufactured goods, JPY bn","Japan, Exports, US, Group, Manufactured goods, JPY bn",None,line
"Japan, Exports, US, Group, Mineral fuels, JPY bn","Japan, Exports, US, Group, Mineral fuels, JPY bn",None,line
"Japan, Exports, US, Group, Others, JPY bn","Japan, Exports, US, Group, Others, JPY bn",None,line
"Japan, Exports, US, Group, Raw materials, JPY bn","Japan, Exports, US, Group, Raw materials, JPY bn",None,line
"Japan, Exports, US, Group, Transport equipment, JPY bn","Japan, Exports, US, Group, Transport equipment, JPY bn",None,line
"Japan, Exports, US, IC, JPY bn","Japan, Exports, US, IC, JPY bn",None,line
"Japan, Exports, US, IC, Volume, MNO","Japan, Exports, US, IC, Volume, MNO",None,line
"Japan, Exports, US, Semicon machinery, JPY bn","Japan, Exports, US, Semicon machinery, JPY bn",None,line
"Japan, Exports, US, Semicon machinery, Volume, MT","Japan, Exports, US, Semicon machinery, Volume, MT",None,line
"Japan, Exports, US, Semiconductors, JPY bn","Japan, Exports, US, Semiconductors, JPY bn",None,line
"Japan, Exports, US, Ships, JPY bn","Japan, Exports, US, Ships, JPY bn",None,line
"Japan, Exports, US, Ships, Volume, GT","Japan, Exports, US, Ships, Volume, GT",None,line
"Japan, Exports, US, Total, JPY bn","Japan, Exports, US, Total, JPY bn",None,line
"Japan, Exports, China and Hong Kong, JPY bn","Japan, Exports, China and Hong Kong, JPY bn",None,line
"Japan, Exports, North Asia, JPY bn","Japan, Exports, North Asia, JPY bn",None,line
"Japan, Exports, DM excl Japan, JPY bn","Japan, Exports, DM excl Japan, JPY bn",None,line
"Japan, Exports, ROW, JPY bn","Japan, Exports, ROW, JPY bn",None,line
"Japan, Exports, Excluding DM, CN, NA, ASEAN, ME, JPY bn","Japan, Exports, Excluding DM, CN, NA, ASEAN, ME, JPY bn",None,line
"Japan, Imports, China and Hong Kong, JPY bn","Japan, Imports, China and Hong Kong, JPY bn",None,line
"Japan, Imports, North Asia, JPY bn","Japan, Imports, North Asia, JPY bn",None,line
"Japan, Imports, DM excl Japan, JPY bn","Japan, Imports, DM excl Japan, JPY bn",None,line
"Japan, Imports, ROW, JPY bn","Japan, Imports, ROW, JPY bn",None,line
"Japan, Imports, Excluding DM, CN, NA, ASEAN, ME, JPY bn","Japan, Imports, Excluding DM, CN, NA, ASEAN, ME, JPY bn",None,line
"Japan, Trade balance, ASEAN, JPY bn","Japan, Trade balance, ASEAN, JPY bn",None,line
"Japan, Trade balance, Africa, JPY bn","Japan, Trade balance, Africa, JPY bn",None,line
"Japan, Trade balance, Asia, JPY bn","Japan, Trade balance, Asia, JPY bn",None,line
"Japan, Trade balance, Central and Eastern Europe, JPY bn","Japan, Trade balance, Central and Eastern Europe, JPY bn",None,line
"Japan, Trade balance, China, JPY bn","Japan, Trade balance, China, JPY bn",None,line
"Japan, Trade balance, Developed Europe, JPY bn","Japan, Trade balance, Developed Europe, JPY bn",None,line
"Japan, Trade balance, EU, JPY bn","Japan, Trade balance, EU, JPY bn",None,line
"Japan, Trade balance, Hong Kong, JPY bn","Japan, Trade balance, Hong Kong, JPY bn",None,line
"Japan, Trade balance, Middle East, JPY bn","Japan, Trade balance, Middle East, JPY bn",None,line
"Japan, Trade balance, Middle South America, JPY bn","Japan, Trade balance, Middle South America, JPY bn",None,line
"Japan, Trade balance, North America, JPY bn","Japan, Trade balance, North America, JPY bn",None,line
"Japan, Trade balance, Taiwan, JPY bn","Japan, Trade balance, Taiwan, JPY bn",None,line
"Japan, Trade balance, Total, JPY bn","Japan, Trade balance, Total, JPY bn",None,line
"Japan, Trade balance, US, JPY bn","Japan, Trade balance, US, JPY bn",None,line
"Japan, Trade balance, Vietnam, JPY bn","Japan, Trade balance, Vietnam, JPY bn",None,line
"Japan, Trade balance, World, JPY bn","Japan, Trade balance, World, JPY bn",None,line
"Japan, Trade balance, nan, JPY bn","Japan, Trade balance, nan, JPY bn",None,line
"Japan, Trade balance, China and Hong Kong, JPY bn","Japan, Trade balance, China and Hong Kong, JPY bn",None,line
"Japan, Trade balance, North Asia, JPY bn","Japan, Trade balance, North Asia, JPY bn",None,line
"Japan, Trade balance, DM excl Japan, JPY bn","Japan, Trade balance, DM excl Japan, JPY bn",None,line
"Japan, Trade balance, ROW, JPY bn","Japan, Trade balance, ROW, JPY bn",None,line
"Japan, Trade balance, Excluding DM, CN, NA, ASEAN, ME, JPY bn","Japan, Trade balance, Excluding DM, CN, NA, ASEAN, ME, JPY bn",None,line
"Japan, Trade balance, All, JPY bn","Japan, Trade balance, All, JPY bn",None,line
"Japan, Exports, Semiconductors and semicon machinery, JPY bn","Japan, Exports, Semiconductors and semicon machinery, JPY bn",None,line
"Japan, Exports, China excluding semicon machinery, JPY bn","Japan, Exports, China excluding semicon machinery, JPY bn",None,line
"Japan, Exports, China and Hong Kong excluding semicon machinery, JPY bn","Japan, Exports, China and Hong Kong excluding semicon machinery, JPY bn",None,line
"Japan, Exports, Asean, Chemicals, Quantum, Index","Japan, Exports, Asean, Chemicals, Quantum, Index",None,line
"Japan, Exports, Asean, Chemicals, Unit value, Index","Japan, Exports, Asean, Chemicals, Unit value, Index",None,line
"Japan, Exports, Asean, Chemicals, Value, Index","Japan, Exports, Asean, Chemicals, Value, Index",None,line
"Japan, Exports, Asean, Food-stuff, Quantum, Index","Japan, Exports, Asean, Food-stuff, Quantum, Index",None,line
"Japan, Exports, Asean, Food-stuff, Unit value, Index","Japan, Exports, Asean, Food-stuff, Unit value, Index",None,line
"Japan, Exports, Asean, Food-stuff, Value, Index","Japan, Exports, Asean, Food-stuff, Value, Index",None,line
"Japan, Exports, Asean, Machinery & Equipment, Quantum, Index","Japan, Exports, Asean, Machinery & Equipment, Quantum, Index",None,line
"Japan, Exports, Asean, Machinery & Equipment, Unit value, Index","Japan, Exports, Asean, Machinery & Equipment, Unit value, Index",None,line
"Japan, Exports, Asean, Machinery & Equipment, Value, Index","Japan, Exports, Asean, Machinery & Equipment, Value, Index",None,line
"Japan, Exports, Asean, Manufs, Quantum, Index","Japan, Exports, Asean, Manufs, Quantum, Index",None,line
"Japan, Exports, Asean, Manufs, Unit value, Index","Japan, Exports, Asean, Manufs, Unit value, Index",None,line
"Japan, Exports, Asean, Manufs, Value, Index","Japan, Exports, Asean, Manufs, Value, Index",None,line
"Japan, Exports, Asean, Metals, Quantum, Index","Japan, Exports, Asean, Metals, Quantum, Index",None,line
"Japan, Exports, Asean, Metals, Unit value, Index","Japan, Exports, Asean, Metals, Unit value, Index",None,line
"Japan, Exports, Asean, Metals, Value, Index","Japan, Exports, Asean, Metals, Value, Index",None,line
"Japan, Exports, Asean, Non-Mtl.Min.Manufs, Quantum, Index","Japan, Exports, Asean, Non-Mtl.Min.Manufs, Quantum, Index",None,line
"Japan, Exports, Asean, Non-Mtl.Min.Manufs, Unit value, Index","Japan, Exports, Asean, Non-Mtl.Min.Manufs, Unit value, Index",None,line
"Japan, Exports, Asean, Non-Mtl.Min.Manufs, Value, Index","Japan, Exports, Asean, Non-Mtl.Min.Manufs, Value, Index",None,line
"Japan, Exports, Asean, Raw Materials, Quantum, Index","Japan, Exports, Asean, Raw Materials, Quantum, Index",None,line
"Japan, Exports, Asean, Raw Materials, Unit value, Index","Japan, Exports, Asean, Raw Materials, Unit value, Index",None,line
"Japan, Exports, Asean, Raw Materials, Value, Index","Japan, Exports, Asean, Raw Materials, Value, Index",None,line
"Japan, Exports, Asean, Textiles, Quantum, Index","Japan, Exports, Asean, Textiles, Quantum, Index",None,line
"Japan, Exports, Asean, Textiles, Unit value, Index","Japan, Exports, Asean, Textiles, Unit value, Index",None,line
"Japan, Exports, Asean, Textiles, Value, Index","Japan, Exports, Asean, Textiles, Value, Index",None,line
"Japan, Exports, Asean, Total, Quantum, Index","Japan, Exports, Asean, Total, Quantum, Index",None,line
"Japan, Exports, Asean, Total, Unit value, Index","Japan, Exports, Asean, Total, Unit value, Index",None,line
"Japan, Exports, Asean, Total, Value, Index","Japan, Exports, Asean, Total, Value, Index",None,line
"Japan, Exports, Asia Nies, Chemicals, Quantum, Index","Japan, Exports, Asia Nies, Chemicals, Quantum, Index",None,line
"Japan, Exports, Asia Nies, Chemicals, Unit value, Index","Japan, Exports, Asia Nies, Chemicals, Unit value, Index",None,line
"Japan, Exports, Asia Nies, Chemicals, Value, Index","Japan, Exports, Asia Nies, Chemicals, Value, Index",None,line
"Japan, Exports, Asia Nies, Food-stuff, Quantum, Index","Japan, Exports, Asia Nies, Food-stuff, Quantum, Index",None,line
"Japan, Exports, Asia Nies, Food-stuff, Unit value, Index","Japan, Exports, Asia Nies, Food-stuff, Unit value, Index",None,line
"Japan, Exports, Asia Nies, Food-stuff, Value, Index","Japan, Exports, Asia Nies, Food-stuff, Value, Index",None,line
"Japan, Exports, Asia Nies, Machinery & Equipment, Quantum, Index","Japan, Exports, Asia Nies, Machinery & Equipment, Quantum, Index",None,line
"Japan, Exports, Asia Nies, Machinery & Equipment, Unit value, Index","Japan, Exports, Asia Nies, Machinery & Equipment, Unit value, Index",None,line
"Japan, Exports, Asia Nies, Machinery & Equipment, Value, Index","Japan, Exports, Asia Nies, Machinery & Equipment, Value, Index",None,line
"Japan, Exports, Asia Nies, Manufs, Quantum, Index","Japan, Exports, Asia Nies, Manufs, Quantum, Index",None,line
"Japan, Exports, Asia Nies, Manufs, Unit value, Index","Japan, Exports, Asia Nies, Manufs, Unit value, Index",None,line
"Japan, Exports, Asia Nies, Manufs, Value, Index","Japan, Exports, Asia Nies, Manufs, Value, Index",None,line
"Japan, Exports, Asia Nies, Metals, Quantum, Index","Japan, Exports, Asia Nies, Metals, Quantum, Index",None,line
"Japan, Exports, Asia Nies, Metals, Unit value, Index","Japan, Exports, Asia Nies, Metals, Unit value, Index",None,line
"Japan, Exports, Asia Nies, Metals, Value, Index","Japan, Exports, Asia Nies, Metals, Value, Index",None,line
"Japan, Exports, Asia Nies, Non-Mtl.Min.Manufs, Quantum, Index","Japan, Exports, Asia Nies, Non-Mtl.Min.Manufs, Quantum, Index",None,line
"Japan, Exports, Asia Nies, Non-Mtl.Min.Manufs, Unit value, Index","Japan, Exports, Asia Nies, Non-Mtl.Min.Manufs, Unit value, Index",None,line
"Japan, Exports, Asia Nies, Non-Mtl.Min.Manufs, Value, Index","Japan, Exports, Asia Nies, Non-Mtl.Min.Manufs, Value, Index",None,line
"Japan, Exports, Asia Nies, Raw Materials, Quantum, Index","Japan, Exports, Asia Nies, Raw Materials, Quantum, Index",None,line
"Japan, Exports, Asia Nies, Raw Materials, Unit value, Index","Japan, Exports, Asia Nies, Raw Materials, Unit value, Index",None,line
"Japan, Exports, Asia Nies, Raw Materials, Value, Index","Japan, Exports, Asia Nies, Raw Materials, Value, Index",None,line
"Japan, Exports, Asia Nies, Textiles, Quantum, Index","Japan, Exports, Asia Nies, Textiles, Quantum, Index",None,line
"Japan, Exports, Asia Nies, Textiles, Unit value, Index","Japan, Exports, Asia Nies, Textiles, Unit value, Index",None,line
"Japan, Exports, Asia Nies, Textiles, Value, Index","Japan, Exports, Asia Nies, Textiles, Value, Index",None,line
"Japan, Exports, Asia Nies, Total, Quantum, Index","Japan, Exports, Asia Nies, Total, Quantum, Index",None,line
"Japan, Exports, Asia Nies, Total, Unit value, Index","Japan, Exports, Asia Nies, Total, Unit value, Index",None,line
"Japan, Exports, Asia Nies, Total, Value, Index","Japan, Exports, Asia Nies, Total, Value, Index",None,line
"Japan, Exports, Asia, Chemicals, Quantum, Index","Japan, Exports, Asia, Chemicals, Quantum, Index",None,line
"Japan, Exports, Asia, Chemicals, Unit value, Index","Japan, Exports, Asia, Chemicals, Unit value, Index",None,line
"Japan, Exports, Asia, Chemicals, Value, Index","Japan, Exports, Asia, Chemicals, Value, Index",None,line
"Japan, Exports, Asia, Food-stuff, Quantum, Index","Japan, Exports, Asia, Food-stuff, Quantum, Index",None,line
"Japan, Exports, Asia, Food-stuff, Unit value, Index","Japan, Exports, Asia, Food-stuff, Unit value, Index",None,line
"Japan, Exports, Asia, Food-stuff, Value, Index","Japan, Exports, Asia, Food-stuff, Value, Index",None,line
"Japan, Exports, Asia, Machinery & Equipment, Quantum, Index","Japan, Exports, Asia, Machinery & Equipment, Quantum, Index",None,line
"Japan, Exports, Asia, Machinery & Equipment, Unit value, Index","Japan, Exports, Asia, Machinery & Equipment, Unit value, Index",None,line
"Japan, Exports, Asia, Machinery & Equipment, Value, Index","Japan, Exports, Asia, Machinery & Equipment, Value, Index",None,line
"Japan, Exports, Asia, Manufs, Quantum, Index","Japan, Exports, Asia, Manufs, Quantum, Index",None,line
"Japan, Exports, Asia, Manufs, Unit value, Index","Japan, Exports, Asia, Manufs, Unit value, Index",None,line
"Japan, Exports, Asia, Manufs, Value, Index","Japan, Exports, Asia, Manufs, Value, Index",None,line
"Japan, Exports, Asia, Metals, Quantum, Index","Japan, Exports, Asia, Metals, Quantum, Index",None,line
"Japan, Exports, Asia, Metals, Unit value, Index","Japan, Exports, Asia, Metals, Unit value, Index",None,line
"Japan, Exports, Asia, Metals, Value, Index","Japan, Exports, Asia, Metals, Value, Index",None,line
"Japan, Exports, Asia, Non-Mtl.Min.Manufs, Quantum, Index","Japan, Exports, Asia, Non-Mtl.Min.Manufs, Quantum, Index",None,line
"Japan, Exports, Asia, Non-Mtl.Min.Manufs, Unit value, Index","Japan, Exports, Asia, Non-Mtl.Min.Manufs, Unit value, Index",None,line
"Japan, Exports, Asia, Non-Mtl.Min.Manufs, Value, Index","Japan, Exports, Asia, Non-Mtl.Min.Manufs, Value, Index",None,line
"Japan, Exports, Asia, Raw Materials, Quantum, Index","Japan, Exports, Asia, Raw Materials, Quantum, Index",None,line
"Japan, Exports, Asia, Raw Materials, Unit value, Index","Japan, Exports, Asia, Raw Materials, Unit value, Index",None,line
"Japan, Exports, Asia, Raw Materials, Value, Index","Japan, Exports, Asia, Raw Materials, Value, Index",None,line
"Japan, Exports, Asia, Textiles, Quantum, Index","Japan, Exports, Asia, Textiles, Quantum, Index",None,line
"Japan, Exports, Asia, Textiles, Unit value, Index","Japan, Exports, Asia, Textiles, Unit value, Index",None,line
"Japan, Exports, Asia, Textiles, Value, Index","Japan, Exports, Asia, Textiles, Value, Index",None,line
"Japan, Exports, Asia, Total, Quantum, Index","Japan, Exports, Asia, Total, Quantum, Index",None,line
"Japan, Exports, Asia, Total, Unit value, Index","Japan, Exports, Asia, Total, Unit value, Index",None,line
"Japan, Exports, Asia, Total, Value, Index","Japan, Exports, Asia, Total, Value, Index",None,line
"Japan, Exports, China, Chemicals, Quantum, Index","Japan, Exports, China, Chemicals, Quantum, Index",None,line
"Japan, Exports, China, Chemicals, Unit value, Index","Japan, Exports, China, Chemicals, Unit value, Index",None,line
"Japan, Exports, China, Chemicals, Value, Index","Japan, Exports, China, Chemicals, Value, Index",None,line
"Japan, Exports, China, Food-stuff, Quantum, Index","Japan, Exports, China, Food-stuff, Quantum, Index",None,line
"Japan, Exports, China, Food-stuff, Unit value, Index","Japan, Exports, China, Food-stuff, Unit value, Index",None,line
"Japan, Exports, China, Food-stuff, Value, Index","Japan, Exports, China, Food-stuff, Value, Index",None,line
"Japan, Exports, China, Machinery & Equipment, Quantum, Index","Japan, Exports, China, Machinery & Equipment, Quantum, Index",None,line
"Japan, Exports, China, Machinery & Equipment, Unit value, Index","Japan, Exports, China, Machinery & Equipment, Unit value, Index",None,line
"Japan, Exports, China, Machinery & Equipment, Value, Index","Japan, Exports, China, Machinery & Equipment, Value, Index",None,line
"Japan, Exports, China, Manufs, Quantum, Index","Japan, Exports, China, Manufs, Quantum, Index",None,line
"Japan, Exports, China, Manufs, Unit value, Index","Japan, Exports, China, Manufs, Unit value, Index",None,line
"Japan, Exports, China, Manufs, Value, Index","Japan, Exports, China, Manufs, Value, Index",None,line
"Japan, Exports, China, Metals, Quantum, Index","Japan, Exports, China, Metals, Quantum, Index",None,line
"Japan, Exports, China, Metals, Unit value, Index","Japan, Exports, China, Metals, Unit value, Index",None,line
"Japan, Exports, China, Metals, Value, Index","Japan, Exports, China, Metals, Value, Index",None,line
"Japan, Exports, China, Non-Mtl.Min.Manufs, Quantum, Index","Japan, Exports, China, Non-Mtl.Min.Manufs, Quantum, Index",None,line
"Japan, Exports, China, Non-Mtl.Min.Manufs, Unit value, Index","Japan, Exports, China, Non-Mtl.Min.Manufs, Unit value, Index",None,line
"Japan, Exports, China, Non-Mtl.Min.Manufs, Value, Index","Japan, Exports, China, Non-Mtl.Min.Manufs, Value, Index",None,line
"Japan, Exports, China, Raw Materials, Quantum, Index","Japan, Exports, China, Raw Materials, Quantum, Index",None,line
"Japan, Exports, China, Raw Materials, Unit value, Index","Japan, Exports, China, Raw Materials, Unit value, Index",None,line
"Japan, Exports, China, Raw Materials, Value, Index","Japan, Exports, China, Raw Materials, Value, Index",None,line
