name,display_name,data_type,chart_type
"Japan, Exports, Excluding DM, CN, NA, ASEAN, ME, % of total","Japan, Exports, Excluding DM, CN, NA, ASEAN, ME, % of total",None,line
"Japan, Exports, Semiconductors and semicon machinery, % of total","Japan, Exports, Semiconductors and semicon machinery, % of total",None,line
"Japan, Exports, China excluding semicon machinery, % of total","Japan, Exports, China excluding semicon machinery, % of total",None,line
"Japan, Exports, China and Hong Kong excluding semicon machinery, % of total","Japan, Exports, China and Hong Kong excluding semicon machinery, % of total",None,line
"Japan, Exports, Afghanistan, Passenger cars, % of total","Japan, Exports, Afghanistan, Passenger cars, % of total",None,line
"Japan, Exports, Bhutan, Passenger cars, % of total","Japan, Exports, Bhutan, Passenger cars, % of total",None,line
"Japan, Exports, Bosnia and Herzegovina, Passenger cars, % of total","Japan, Exports, Bosnia and Herzegovina, Passenger cars, % of total",None,line
"Japan, Exports, British Anguilla, Passenger cars, % of total","Japan, Exports, British Anguilla, Passenger cars, % of total",None,line
"Japan, Exports, British Antarctic Territory, Passenger cars, % of total","Japan, Exports, British Antarctic Territory, Passenger cars, % of total",None,line
"Japan, Exports, British indian Ocean Territories, Passenger cars, % of total","Japan, Exports, British indian Ocean Territories, Passenger cars, % of total",None,line
"Japan, Exports, Central Africa, Passenger cars, % of total","Japan, Exports, Central Africa, Passenger cars, % of total",None,line
"Japan, Exports, Colombia, Passenger cars, % of total","Japan, Exports, Colombia, Passenger cars, % of total",None,line
"Japan, Exports, Cook, Passenger cars, % of total","Japan, Exports, Cook, Passenger cars, % of total",None,line
"Japan, Exports, Democratic Republic of Congo, Passenger cars, % of total","Japan, Exports, Democratic Republic of Congo, Passenger cars, % of total",None,line
"Japan, Exports, Dominica, Passenger cars, % of total","Japan, Exports, Dominica, Passenger cars, % of total",None,line
"Japan, Exports, Dominican Republic, Passenger cars, % of total","Japan, Exports, Dominican Republic, Passenger cars, % of total",None,line
"Japan, Exports, For Order, Passenger cars, % of total","Japan, Exports, For Order, Passenger cars, % of total",None,line
"Japan, Exports, French West Indies, Passenger cars, % of total","Japan, Exports, French West Indies, Passenger cars, % of total",None,line
"Japan, Exports, Guatemala, Passenger cars, % of total","Japan, Exports, Guatemala, Passenger cars, % of total",None,line
"Japan, Exports, Hong Kong, Passenger cars, % of total","Japan, Exports, Hong Kong, Passenger cars, % of total",None,line
"Japan, Exports, Kyrgyz, Passenger cars, % of total","Japan, Exports, Kyrgyz, Passenger cars, % of total",None,line
"Japan, Exports, Luxembourg, Passenger cars, % of total","Japan, Exports, Luxembourg, Passenger cars, % of total",None,line
"Japan, Exports, Marshall, Passenger cars, % of total","Japan, Exports, Marshall, Passenger cars, % of total",None,line
"Japan, Exports, Mauritania, Passenger cars, % of total","Japan, Exports, Mauritania, Passenger cars, % of total",None,line
"Japan, Exports, Nauru, Passenger cars, % of total","Japan, Exports, Nauru, Passenger cars, % of total",None,line
"Japan, Exports, Netherlands Antilles, Passenger cars, % of total","Japan, Exports, Netherlands Antilles, Passenger cars, % of total",None,line
"Japan, Exports, Netherlands, Passenger cars, % of total","Japan, Exports, Netherlands, Passenger cars, % of total",None,line
"Japan, Exports, North Macedonia, Passenger cars, % of total","Japan, Exports, North Macedonia, Passenger cars, % of total",None,line
"Japan, Exports, Pakistan, Passenger cars, % of total","Japan, Exports, Pakistan, Passenger cars, % of total",None,line
"Japan, Exports, Portugal, Passenger cars, % of total","Japan, Exports, Portugal, Passenger cars, % of total",None,line
"Japan, Exports, Rep. of Cote d'Ivoire, Passenger cars, % of total","Japan, Exports, Rep. of Cote d'Ivoire, Passenger cars, % of total",None,line
"Japan, Exports, Republic of Congo, Passenger cars, % of total","Japan, Exports, Republic of Congo, Passenger cars, % of total",None,line
"Japan, Exports, Sao Tome and Principe, Passenger cars, % of total","Japan, Exports, Sao Tome and Principe, Passenger cars, % of total",None,line
"Japan, Exports, Sri Lanka, Passenger cars, % of total","Japan, Exports, Sri Lanka, Passenger cars, % of total",None,line
"Japan, Exports, St.Christopher and Nevis, Passenger cars, % of total","Japan, Exports, St.Christopher and Nevis, Passenger cars, % of total",None,line
"Japan, Exports, St.Lucia, Passenger cars, % of total","Japan, Exports, St.Lucia, Passenger cars, % of total",None,line
"Japan, Exports, St.Vincent, Passenger cars, % of total","Japan, Exports, St.Vincent, Passenger cars, % of total",None,line
"Japan, Exports, Switzerland, Passenger cars, % of total","Japan, Exports, Switzerland, Passenger cars, % of total",None,line
"Japan, Exports, Taiwan, Passenger cars, % of total","Japan, Exports, Taiwan, Passenger cars, % of total",None,line
"Japan, Exports, The West Bank and Gaza Strip, Passenger cars, % of total","Japan, Exports, The West Bank and Gaza Strip, Passenger cars, % of total",None,line
"Japan, Exports, Timor-Leste, Passenger cars, % of total","Japan, Exports, Timor-Leste, Passenger cars, % of total",None,line
"Japan, Exports, Turkmenistan, Passenger cars, % of total","Japan, Exports, Turkmenistan, Passenger cars, % of total",None,line
"Japan, Exports, US Virgin Islands, Passenger cars, % of total","Japan, Exports, US Virgin Islands, Passenger cars, % of total",None,line
"Japan, Exports, United Arab Emirates, Passenger cars, % of total","Japan, Exports, United Arab Emirates, Passenger cars, % of total",None,line
"Japan, Exports, Viet Nam, Passenger cars, % of total","Japan, Exports, Viet Nam, Passenger cars, % of total",None,line
"Japan, Exports, West Sahara, Passenger cars, % of total","Japan, Exports, West Sahara, Passenger cars, % of total",None,line
"Japan, Exports, ASEAN, Passenger cars, % of total","Japan, Exports, ASEAN, Passenger cars, % of total",None,line
"Japan, BOJ, Exports, All, Volume, Index, SA","Japan, BOJ, Exports, All, Volume, Index, SA",None,line
"Japan, BOJ, Imports, All, Volume, Index, SA","Japan, BOJ, Imports, All, Volume, Index, SA",None,line
"Japan, BOJ, Exports, Volume, United States, Index, SA","Japan, BOJ, Exports, Volume, United States, Index, SA",None,line
"Japan, BOJ, Exports, Volume, EU, Index, SA","Japan, BOJ, Exports, Volume, EU, Index, SA",None,line
"Japan, BOJ, Exports, Volume, China, Index, SA","Japan, BOJ, Exports, Volume, China, Index, SA",None,line
"Japan, BOJ, Exports, Volume, NIEs, ASEAN, etc., Index, SA","Japan, BOJ, Exports, Volume, NIEs, ASEAN, etc., Index, SA",None,line
"Japan, BOJ, Exports, Volume, Other economies, Index, SA","Japan, BOJ, Exports, Volume, Other economies, Index, SA",None,line
"Japan, BOJ, Exports, Volume, Intermediate goods, Index, SA","Japan, BOJ, Exports, Volume, Intermediate goods, Index, SA",None,line
"Japan, BOJ, Exports, Volume, IT-related goods, Index, SA","Japan, BOJ, Exports, Volume, IT-related goods, Index, SA",None,line
"Japan, BOJ, Exports, Volume, Capital goods, Index, SA","Japan, BOJ, Exports, Volume, Capital goods, Index, SA",None,line
"Japan, BOJ, Exports, Volume, Other goods, Index, SA","Japan, BOJ, Exports, Volume, Other goods, Index, SA",None,line
"Japan, BOJ, Exports, Volume, Except other goods, Index, SA","Japan, BOJ, Exports, Volume, Except other goods, Index, SA",None,line
"Japan, Exports, Semicon machinery, SA, % of total","Japan, Exports, Semicon machinery, SA, % of total",None,line
"Japan, Exports, Semiconductors, SA, % of total","Japan, Exports, Semiconductors, SA, % of total",None,line
"Japan, Exports, Semiconductors and semicon machinery, SA, % of total","Japan, Exports, Semiconductors and semicon machinery, SA, % of total",None,line
"Japan, Exports, All, % of GDP","Japan, Exports, All, % of GDP",None,line
"Japan, Imports, All, % of GDP","Japan, Imports, All, % of GDP",None,line
"Japan, Imports, Group, Chemicals, % of GDP","Japan, Imports, Group, Chemicals, % of GDP",None,line
"Japan, Imports, Group, Electrical machinery, % of GDP","Japan, Imports, Group, Electrical machinery, % of GDP",None,line
"Japan, Imports, Group, Foodstuffs, % of GDP","Japan, Imports, Group, Foodstuffs, % of GDP",None,line
"Japan, Imports, Group, Machinery, % of GDP","Japan, Imports, Group, Machinery, % of GDP",None,line
"Japan, Imports, Group, Manufactured goods, % of GDP","Japan, Imports, Group, Manufactured goods, % of GDP",None,line
"Japan, Imports, Group, Mineral fuels, % of GDP","Japan, Imports, Group, Mineral fuels, % of GDP",None,line
"Japan, Imports, Group, Others, % of GDP","Japan, Imports, Group, Others, % of GDP",None,line
"Japan, Imports, Group, Raw materials, % of GDP","Japan, Imports, Group, Raw materials, % of GDP",None,line
"Japan, Imports, Group, Transport equipment, % of GDP","Japan, Imports, Group, Transport equipment, % of GDP",None,line
"Japan, Imports, IC, % of GDP","Japan, Imports, IC, % of GDP",None,line
"Japan, Imports, Semiconductors, % of GDP","Japan, Imports, Semiconductors, % of GDP",None,line
"Japan, Exports, Passenger cars, % of GDP","Japan, Exports, Passenger cars, % of GDP",None,line
"Japan, Exports, Group, Chemicals, % of GDP","Japan, Exports, Group, Chemicals, % of GDP",None,line
"Japan, Exports, Group, Electrical machinery, % of GDP","Japan, Exports, Group, Electrical machinery, % of GDP",None,line
"Japan, Exports, Group, Foodstuffs, % of GDP","Japan, Exports, Group, Foodstuffs, % of GDP",None,line
"Japan, Exports, Group, Machinery, % of GDP","Japan, Exports, Group, Machinery, % of GDP",None,line
"Japan, Exports, Group, Manufactured goods, % of GDP","Japan, Exports, Group, Manufactured goods, % of GDP",None,line
"Japan, Exports, Group, Mineral fuels, % of GDP","Japan, Exports, Group, Mineral fuels, % of GDP",None,line
"Japan, Exports, Group, Others, % of GDP","Japan, Exports, Group, Others, % of GDP",None,line
"Japan, Exports, Group, Raw materials, % of GDP","Japan, Exports, Group, Raw materials, % of GDP",None,line
"Japan, Exports, Group, Transport equipment, % of GDP","Japan, Exports, Group, Transport equipment, % of GDP",None,line
"Japan, Exports, IC, % of GDP","Japan, Exports, IC, % of GDP",None,line
"Japan, Exports, Semicon machinery, % of GDP","Japan, Exports, Semicon machinery, % of GDP",None,line
"Japan, Exports, Semiconductors, % of GDP","Japan, Exports, Semiconductors, % of GDP",None,line
"Japan, Exports, Ships, % of GDP","Japan, Exports, Ships, % of GDP",None,line
"Japan, Exports, ASEAN, % of GDP","Japan, Exports, ASEAN, % of GDP",None,line
"Japan, Exports, Africa, % of GDP","Japan, Exports, Africa, % of GDP",None,line
"Japan, Exports, Asia, % of GDP","Japan, Exports, Asia, % of GDP",None,line
"Japan, Exports, Central and Eastern Europe, % of GDP","Japan, Exports, Central and Eastern Europe, % of GDP",None,line
"Japan, Exports, China, % of GDP","Japan, Exports, China, % of GDP",None,line
"Japan, Exports, Developed Europe, % of GDP","Japan, Exports, Developed Europe, % of GDP",None,line
"Japan, Exports, EU, % of GDP","Japan, Exports, EU, % of GDP",None,line
"Japan, Exports, Hong Kong, % of GDP","Japan, Exports, Hong Kong, % of GDP",None,line
"Japan, Exports, Middle East, % of GDP","Japan, Exports, Middle East, % of GDP",None,line
"Japan, Exports, Middle South America, % of GDP","Japan, Exports, Middle South America, % of GDP",None,line
"Japan, Exports, North America, % of GDP","Japan, Exports, North America, % of GDP",None,line
"Japan, Exports, Taiwan, % of GDP","Japan, Exports, Taiwan, % of GDP",None,line
"Japan, Exports, Total, % of GDP","Japan, Exports, Total, % of GDP",None,line
"Japan, Exports, US, % of GDP","Japan, Exports, US, % of GDP",None,line
"Japan, Exports, Vietnam, % of GDP","Japan, Exports, Vietnam, % of GDP",None,line
"Japan, Exports, World, % of GDP","Japan, Exports, World, % of GDP",None,line
"Japan, Exports, nan, % of GDP","Japan, Exports, nan, % of GDP",None,line
"Japan, Imports, ASEAN, % of GDP","Japan, Imports, ASEAN, % of GDP",None,line
"Japan, Imports, Africa, % of GDP","Japan, Imports, Africa, % of GDP",None,line
"Japan, Imports, Asia, % of GDP","Japan, Imports, Asia, % of GDP",None,line
"Japan, Imports, Central and Eastern Europe, % of GDP","Japan, Imports, Central and Eastern Europe, % of GDP",None,line
"Japan, Imports, China, % of GDP","Japan, Imports, China, % of GDP",None,line
"Japan, Imports, Developed Europe, % of GDP","Japan, Imports, Developed Europe, % of GDP",None,line
"Japan, Imports, EU, % of GDP","Japan, Imports, EU, % of GDP",None,line
"Japan, Imports, Hong Kong, % of GDP","Japan, Imports, Hong Kong, % of GDP",None,line
"Japan, Imports, Middle East, % of GDP","Japan, Imports, Middle East, % of GDP",None,line
"Japan, Imports, Middle South America, % of GDP","Japan, Imports, Middle South America, % of GDP",None,line
"Japan, Imports, North America, % of GDP","Japan, Imports, North America, % of GDP",None,line
"Japan, Imports, Taiwan, % of GDP","Japan, Imports, Taiwan, % of GDP",None,line
"Japan, Imports, Total, % of GDP","Japan, Imports, Total, % of GDP",None,line
"Japan, Imports, US, % of GDP","Japan, Imports, US, % of GDP",None,line
"Japan, Imports, Vietnam, % of GDP","Japan, Imports, Vietnam, % of GDP",None,line
"Japan, Imports, World, % of GDP","Japan, Imports, World, % of GDP",None,line
"Japan, Imports, nan, % of GDP","Japan, Imports, nan, % of GDP",None,line
"Japan, Exports, China, Passenger cars, % of GDP","Japan, Exports, China, Passenger cars, % of GDP",None,line
"Japan, Exports, China, Group, Chemicals, % of GDP","Japan, Exports, China, Group, Chemicals, % of GDP",None,line
"Japan, Exports, China, Group, Electrical machinery, % of GDP","Japan, Exports, China, Group, Electrical machinery, % of GDP",None,line
"Japan, Exports, China, Group, Foodstuffs, % of GDP","Japan, Exports, China, Group, Foodstuffs, % of GDP",None,line
"Japan, Exports, China, Group, Machinery, % of GDP","Japan, Exports, China, Group, Machinery, % of GDP",None,line
"Japan, Exports, China, Group, Manufactured goods, % of GDP","Japan, Exports, China, Group, Manufactured goods, % of GDP",None,line
"Japan, Exports, China, Group, Mineral fuels, % of GDP","Japan, Exports, China, Group, Mineral fuels, % of GDP",None,line
"Japan, Exports, China, Group, Others, % of GDP","Japan, Exports, China, Group, Others, % of GDP",None,line
"Japan, Exports, China, Group, Raw materials, % of GDP","Japan, Exports, China, Group, Raw materials, % of GDP",None,line
"Japan, Exports, China, Group, Transport equipment, % of GDP","Japan, Exports, China, Group, Transport equipment, % of GDP",None,line
"Japan, Exports, China, IC, % of GDP","Japan, Exports, China, IC, % of GDP",None,line
"Japan, Exports, China, Semicon machinery, % of GDP","Japan, Exports, China, Semicon machinery, % of GDP",None,line
"Japan, Exports, China, Semiconductors, % of GDP","Japan, Exports, China, Semiconductors, % of GDP",None,line
"Japan, Exports, China, Ships, % of GDP","Japan, Exports, China, Ships, % of GDP",None,line
"Japan, Exports, China, Total, % of GDP","Japan, Exports, China, Total, % of GDP",None,line
"Japan, Imports, China, Group, Chemicals, % of GDP","Japan, Imports, China, Group, Chemicals, % of GDP",None,line
"Japan, Imports, China, Group, Electrical machinery, % of GDP","Japan, Imports, China, Group, Electrical machinery, % of GDP",None,line
"Japan, Imports, China, Group, Foodstuffs, % of GDP","Japan, Imports, China, Group, Foodstuffs, % of GDP",None,line
"Japan, Imports, China, Group, Machinery, % of GDP","Japan, Imports, China, Group, Machinery, % of GDP",None,line
"Japan, Imports, China, Group, Manufactured goods, % of GDP","Japan, Imports, China, Group, Manufactured goods, % of GDP",None,line
"Japan, Imports, China, Group, Mineral fuels, % of GDP","Japan, Imports, China, Group, Mineral fuels, % of GDP",None,line
"Japan, Imports, China, Group, Others, % of GDP","Japan, Imports, China, Group, Others, % of GDP",None,line
"Japan, Imports, China, Group, Raw materials, % of GDP","Japan, Imports, China, Group, Raw materials, % of GDP",None,line
"Japan, Imports, China, Group, Transport equipment, % of GDP","Japan, Imports, China, Group, Transport equipment, % of GDP",None,line
"Japan, Imports, China, IC, % of GDP","Japan, Imports, China, IC, % of GDP",None,line
"Japan, Imports, China, Semiconductors, % of GDP","Japan, Imports, China, Semiconductors, % of GDP",None,line
"Japan, Imports, China, Total, % of GDP","Japan, Imports, China, Total, % of GDP",None,line
"Japan, Exports, US, Passenger cars, % of GDP","Japan, Exports, US, Passenger cars, % of GDP",None,line
"Japan, Exports, US, Group, Chemicals, % of GDP","Japan, Exports, US, Group, Chemicals, % of GDP",None,line
"Japan, Exports, US, Group, Electrical machinery, % of GDP","Japan, Exports, US, Group, Electrical machinery, % of GDP",None,line
"Japan, Exports, US, Group, Foodstuffs, % of GDP","Japan, Exports, US, Group, Foodstuffs, % of GDP",None,line
"Japan, Exports, US, Group, Machinery, % of GDP","Japan, Exports, US, Group, Machinery, % of GDP",None,line
"Japan, Exports, US, Group, Manufactured goods, % of GDP","Japan, Exports, US, Group, Manufactured goods, % of GDP",None,line
"Japan, Exports, US, Group, Mineral fuels, % of GDP","Japan, Exports, US, Group, Mineral fuels, % of GDP",None,line
"Japan, Exports, US, Group, Others, % of GDP","Japan, Exports, US, Group, Others, % of GDP",None,line
"Japan, Exports, US, Group, Raw materials, % of GDP","Japan, Exports, US, Group, Raw materials, % of GDP",None,line
"Japan, Exports, US, Group, Transport equipment, % of GDP","Japan, Exports, US, Group, Transport equipment, % of GDP",None,line
"Japan, Exports, US, IC, % of GDP","Japan, Exports, US, IC, % of GDP",None,line
"Japan, Exports, US, Semicon machinery, % of GDP","Japan, Exports, US, Semicon machinery, % of GDP",None,line
"Japan, Exports, US, Semiconductors, % of GDP","Japan, Exports, US, Semiconductors, % of GDP",None,line
"Japan, Exports, US, Ships, % of GDP","Japan, Exports, US, Ships, % of GDP",None,line
"Japan, Exports, US, Total, % of GDP","Japan, Exports, US, Total, % of GDP",None,line
"Japan, Exports, China and Hong Kong, % of GDP","Japan, Exports, China and Hong Kong, % of GDP",None,line
"Japan, Exports, North Asia, % of GDP","Japan, Exports, North Asia, % of GDP",None,line
"Japan, Exports, DM excl Japan, % of GDP","Japan, Exports, DM excl Japan, % of GDP",None,line
"Japan, Exports, ROW, % of GDP","Japan, Exports, ROW, % of GDP",None,line
"Japan, Exports, Excluding DM, CN, NA, ASEAN, ME, % of GDP","Japan, Exports, Excluding DM, CN, NA, ASEAN, ME, % of GDP",None,line
"Japan, Imports, China and Hong Kong, % of GDP","Japan, Imports, China and Hong Kong, % of GDP",None,line
"Japan, Imports, North Asia, % of GDP","Japan, Imports, North Asia, % of GDP",None,line
"Japan, Imports, DM excl Japan, % of GDP","Japan, Imports, DM excl Japan, % of GDP",None,line
"Japan, Imports, ROW, % of GDP","Japan, Imports, ROW, % of GDP",None,line
"Japan, Imports, Excluding DM, CN, NA, ASEAN, ME, % of GDP","Japan, Imports, Excluding DM, CN, NA, ASEAN, ME, % of GDP",None,line
"Japan, Trade balance, ASEAN, % of GDP","Japan, Trade balance, ASEAN, % of GDP",None,line
"Japan, Trade balance, Africa, % of GDP","Japan, Trade balance, Africa, % of GDP",None,line
"Japan, Trade balance, Asia, % of GDP","Japan, Trade balance, Asia, % of GDP",None,line
"Japan, Trade balance, Central and Eastern Europe, % of GDP","Japan, Trade balance, Central and Eastern Europe, % of GDP",None,line
"Japan, Trade balance, China, % of GDP","Japan, Trade balance, China, % of GDP",None,line
"Japan, Trade balance, Developed Europe, % of GDP","Japan, Trade balance, Developed Europe, % of GDP",None,line
"Japan, Trade balance, EU, % of GDP","Japan, Trade balance, EU, % of GDP",None,line
"Japan, Trade balance, Hong Kong, % of GDP","Japan, Trade balance, Hong Kong, % of GDP",None,line
"Japan, Trade balance, Middle East, % of GDP","Japan, Trade balance, Middle East, % of GDP",None,line
"Japan, Trade balance, Middle South America, % of GDP","Japan, Trade balance, Middle South America, % of GDP",None,line
"Japan, Trade balance, North America, % of GDP","Japan, Trade balance, North America, % of GDP",None,line
"Japan, Trade balance, Taiwan, % of GDP","Japan, Trade balance, Taiwan, % of GDP",None,line
"Japan, Trade balance, Total, % of GDP","Japan, Trade balance, Total, % of GDP",None,line
"Japan, Trade balance, US, % of GDP","Japan, Trade balance, US, % of GDP",None,line
"Japan, Trade balance, Vietnam, % of GDP","Japan, Trade balance, Vietnam, % of GDP",None,line
"Japan, Trade balance, World, % of GDP","Japan, Trade balance, World, % of GDP",None,line
"Japan, Trade balance, nan, % of GDP","Japan, Trade balance, nan, % of GDP",None,line
"Japan, Trade balance, China and Hong Kong, % of GDP","Japan, Trade balance, China and Hong Kong, % of GDP",None,line
"Japan, Trade balance, North Asia, % of GDP","Japan, Trade balance, North Asia, % of GDP",None,line
"Japan, Trade balance, DM excl Japan, % of GDP","Japan, Trade balance, DM excl Japan, % of GDP",None,line
"Japan, Trade balance, ROW, % of GDP","Japan, Trade balance, ROW, % of GDP",None,line
"Japan, Trade balance, Excluding DM, CN, NA, ASEAN, ME, % of GDP","Japan, Trade balance, Excluding DM, CN, NA, ASEAN, ME, % of GDP",None,line
"Japan, Trade balance, All, % of GDP","Japan, Trade balance, All, % of GDP",None,line
"Japan, Exports, Semiconductors and semicon machinery, % of GDP","Japan, Exports, Semiconductors and semicon machinery, % of GDP",None,line
"Japan, Exports, China excluding semicon machinery, % of GDP","Japan, Exports, China excluding semicon machinery, % of GDP",None,line
"Japan, Exports, China and Hong Kong excluding semicon machinery, % of GDP","Japan, Exports, China and Hong Kong excluding semicon machinery, % of GDP",None,line
"Japan, Exports, Afghanistan, Passenger cars, % of GDP","Japan, Exports, Afghanistan, Passenger cars, % of GDP",None,line
"Japan, Exports, Bhutan, Passenger cars, % of GDP","Japan, Exports, Bhutan, Passenger cars, % of GDP",None,line
"Japan, Exports, Bosnia and Herzegovina, Passenger cars, % of GDP","Japan, Exports, Bosnia and Herzegovina, Passenger cars, % of GDP",None,line
"Japan, Exports, British Anguilla, Passenger cars, % of GDP","Japan, Exports, British Anguilla, Passenger cars, % of GDP",None,line
"Japan, Exports, British Antarctic Territory, Passenger cars, % of GDP","Japan, Exports, British Antarctic Territory, Passenger cars, % of GDP",None,line
"Japan, Exports, British indian Ocean Territories, Passenger cars, % of GDP","Japan, Exports, British indian Ocean Territories, Passenger cars, % of GDP",None,line
"Japan, Exports, Central Africa, Passenger cars, % of GDP","Japan, Exports, Central Africa, Passenger cars, % of GDP",None,line
"Japan, Exports, Colombia, Passenger cars, % of GDP","Japan, Exports, Colombia, Passenger cars, % of GDP",None,line
"Japan, Exports, Cook, Passenger cars, % of GDP","Japan, Exports, Cook, Passenger cars, % of GDP",None,line
"Japan, Exports, Democratic Republic of Congo, Passenger cars, % of GDP","Japan, Exports, Democratic Republic of Congo, Passenger cars, % of GDP",None,line
"Japan, Exports, Dominica, Passenger cars, % of GDP","Japan, Exports, Dominica, Passenger cars, % of GDP",None,line
"Japan, Exports, Dominican Republic, Passenger cars, % of GDP","Japan, Exports, Dominican Republic, Passenger cars, % of GDP",None,line
"Japan, Exports, For Order, Passenger cars, % of GDP","Japan, Exports, For Order, Passenger cars, % of GDP",None,line
"Japan, Exports, French West Indies, Passenger cars, % of GDP","Japan, Exports, French West Indies, Passenger cars, % of GDP",None,line
"Japan, Exports, Guatemala, Passenger cars, % of GDP","Japan, Exports, Guatemala, Passenger cars, % of GDP",None,line
"Japan, Exports, Hong Kong, Passenger cars, % of GDP","Japan, Exports, Hong Kong, Passenger cars, % of GDP",None,line
"Japan, Exports, Kyrgyz, Passenger cars, % of GDP","Japan, Exports, Kyrgyz, Passenger cars, % of GDP",None,line
"Japan, Exports, Luxembourg, Passenger cars, % of GDP","Japan, Exports, Luxembourg, Passenger cars, % of GDP",None,line
"Japan, Exports, Marshall, Passenger cars, % of GDP","Japan, Exports, Marshall, Passenger cars, % of GDP",None,line
"Japan, Exports, Mauritania, Passenger cars, % of GDP","Japan, Exports, Mauritania, Passenger cars, % of GDP",None,line
"Japan, Exports, Nauru, Passenger cars, % of GDP","Japan, Exports, Nauru, Passenger cars, % of GDP",None,line
"Japan, Exports, Netherlands Antilles, Passenger cars, % of GDP","Japan, Exports, Netherlands Antilles, Passenger cars, % of GDP",None,line
"Japan, Exports, Netherlands, Passenger cars, % of GDP","Japan, Exports, Netherlands, Passenger cars, % of GDP",None,line
"Japan, Exports, North Macedonia, Passenger cars, % of GDP","Japan, Exports, North Macedonia, Passenger cars, % of GDP",None,line
"Japan, Exports, Pakistan, Passenger cars, % of GDP","Japan, Exports, Pakistan, Passenger cars, % of GDP",None,line
"Japan, Exports, Portugal, Passenger cars, % of GDP","Japan, Exports, Portugal, Passenger cars, % of GDP",None,line
"Japan, Exports, Rep. of Cote d'Ivoire, Passenger cars, % of GDP","Japan, Exports, Rep. of Cote d'Ivoire, Passenger cars, % of GDP",None,line
"Japan, Exports, Republic of Congo, Passenger cars, % of GDP","Japan, Exports, Republic of Congo, Passenger cars, % of GDP",None,line
"Japan, Exports, Sao Tome and Principe, Passenger cars, % of GDP","Japan, Exports, Sao Tome and Principe, Passenger cars, % of GDP",None,line
"Japan, Exports, Sri Lanka, Passenger cars, % of GDP","Japan, Exports, Sri Lanka, Passenger cars, % of GDP",None,line
